{
  "$schema": "../../data/schemas/crop_schema.json",
  "id": "corn",
  "name": "Corn",
  "name_key": "CROP_CORN_NAME",
  "description_key": "CROP_CORN_DESC",
  "growth_time": 300,
  "sell_price": 45,
  "seed_cost": 15,
  "unlock_level": 4,
  "sprite_prefix": "corn",
  "stages": [
    {"stage": 0, "name": "seed", "duration": 0},
    {"stage": 1, "name": "sprout", "duration": 60},
    {"stage": 2, "name": "growing", "duration": 75},
    {"stage": 3, "name": "tall", "duration": 75},
    {"stage": 4, "name": "tassels", "duration": 45},
    {"stage": 5, "name": "ears_forming", "duration": 45},
    {"stage": 6, "name": "mature", "duration": 0, "harvestable": true}
  ],
  "seasons": ["summer", "autumn"],
  "water_needs": "medium",
  "quality_factors": {
    "water_bonus": 1.2,
    "fertilizer_bonus": 1.4
  },
  "tags": ["grain", "late_game", "high_value", "long_grow"]
}
