{
  "$schema": "../../data/schemas/crop_schema.json",
  "id": "strawberry",
  "name": "Strawberry",
  "name_key": "CROP_STRAWBERRY_NAME",
  "description_key": "CROP_STRAWBERRY_DESC",
  "growth_time": 150,
  "sell_price": 25,
  "seed_cost": 10,
  "unlock_level": 2,
  "sprite_prefix": "strawberry",
  "stages": [
    {"stage": 0, "name": "seed", "duration": 0},
    {"stage": 1, "name": "sprout", "duration": 37},
    {"stage": 2, "name": "leafy", "duration": 38},
    {"stage": 3, "name": "flowering", "duration": 37},
    {"stage": 4, "name": "fruiting", "duration": 38, "harvestable": true}
  ],
  "seasons": ["spring"],
  "water_needs": "high",
  "quality_factors": {
    "water_bonus": 1.3,
    "fertilizer_bonus": 1.6
  },
  "tags": ["fruit", "high_value", "spring_specialty", "regrowable"]
}
