{
  "$schema": "../../data/schemas/crop_schema.json",
  "id": "wheat",
  "name": "Wheat",
  "name_key": "CROP_WHEAT_NAME",
  "description_key": "CROP_WHEAT_DESC",
  "growth_time": 180,
  "sell_price": 12,
  "seed_cost": 3,
  "unlock_level": 1,
  "sprite_prefix": "wheat",
  "stages": [
    {"stage": 0, "name": "seed", "duration": 0},
    {"stage": 1, "name": "sprout", "duration": 45},
    {"stage": 2, "name": "growing", "duration": 67},
    {"stage": 3, "name": "tall", "duration": 68},
    {"stage": 4, "name": "mature", "duration": 0, "harvestable": true}
  ],
  "seasons": ["spring", "summer", "autumn"],
  "water_needs": "low",
  "quality_factors": {
    "water_bonus": 1.1,
    "fertilizer_bonus": 1.3
  },
  "tags": ["grain", "staple", "beginner_friendly"]
}
